{
  "schema_version": "2.0.0",
  "model_id": "fixture.classifier",
  "version": "1.0.0",
  "wasm_digest": "6c75d9f3d397c4df53e42b29b5794882d053c99e21afa7223de0c23b6df8623f",
  "registry_ref": "registry:fixture.classifier@1.0.0",
  "executable_format": "traverse-model-wasm",
  "abi_version": 1,
  "input_schema_ref": "schema:fixture-classifier-in",
  "input_schema_version": "1.0.0",
  "output_schema_ref": "schema:fixture-classifier-out",
  "output_schema_version": "1.0.0",
  "rights": {
    "license_id": "Apache-2.0",
    "attribution": "Traverse Spec 138 real-inference conformance fixture",
    "redistribution": "test-only; not for production redistribution claims",
    "commercial_use": "allowed",
    "source_url": "https://github.com/traverse-framework/Traverse/tree/main/fixtures/models/fixture-classifier-1.0.0"
  },
  "supported_profiles": [
    "wasm-cpu"
  ],
  "max_memory_bytes": 131072,
  "max_fuel": 1000000,
  "max_input_bytes": 4096,
  "max_output_bytes": 4096,
  "max_execution_ms": 5000,
  "offline_allowed": true
}
