{
  "schema_version": "2.0.0",
  "model_id": "fixture.looper",
  "version": "1.0.0",
  "wasm_digest": "49cfdfde148e4f3646d1f1dbbe4a2a70a23e1bc0b2b7fcbd338cb927437b3b9e",
  "registry_ref": "registry:fixture.looper@1.0.0",
  "executable_format": "traverse-model-wasm",
  "abi_version": 1,
  "input_schema_ref": "schema:fixture-in",
  "input_schema_version": "1.0.0",
  "output_schema_ref": "schema:fixture-out",
  "output_schema_version": "1.0.0",
  "rights": {
    "license_id": "Apache-2.0",
    "attribution": "Traverse Spec 138 interruption conformance fixture",
    "redistribution": "test-only; not for production redistribution claims",
    "commercial_use": "allowed",
    "source_url": "https://github.com/traverse-framework/Traverse/tree/main/fixtures/models/fixture-looper-1.0.0"
  },
  "supported_profiles": [
    "wasm-cpu"
  ],
  "max_memory_bytes": 131072,
  "max_fuel": 9000000000,
  "max_input_bytes": 4096,
  "max_output_bytes": 64,
  "max_execution_ms": 60000,
  "offline_allowed": true
}
