{
  "schema_version": "2.0.0",
  "model_id": "fixture.rights.permissive",
  "version": "1.0.0",
  "wasm_digest": "75d1573debb30016bf2cf5bac33d25abf28de8ef89a809109ffc503824a9e71a",
  "registry_ref": "registry:fixture.rights.permissive@1.0.0",
  "executable_format": "traverse-model-wasm",
  "abi_version": 1,
  "input_schema_ref": "schema:fixture-in",
  "input_schema_version": "1.0.0",
  "output_schema_ref": "schema:fixture-out",
  "output_schema_version": "1.0.0",
  "rights": {
    "license_id": "Apache-2.0",
    "attribution": "Traverse Spec 138 rights conformance fixture",
    "redistribution": "test-only; not for production redistribution claims",
    "commercial_use": "allowed",
    "source_url": "https://example.invalid/rights-conformance"
  },
  "supported_profiles": [
    "wasm-cpu"
  ],
  "max_memory_bytes": 131072,
  "max_fuel": 1000000,
  "max_input_bytes": 4096,
  "max_output_bytes": 4096,
  "max_execution_ms": 5000,
  "offline_allowed": true
}
