{
  "schema_version": "2.0.0",
  "model_id": "traverse.digits-mlp",
  "version": "1.0.0",
  "wasm_digest": "34998df104e76382e654252faceed004ef598f21a860faebe3a5e92311e342b6",
  "registry_ref": "registry:traverse.digits-mlp@1.0.0",
  "executable_format": "traverse-model-wasm",
  "abi_version": 1,
  "input_schema_ref": "schema:traverse-digits-mlp-in",
  "input_schema_version": "1.0.0",
  "output_schema_ref": "schema:traverse-digits-mlp-out",
  "output_schema_version": "1.0.0",
  "rights": {
    "license_id": "CC-BY-4.0",
    "attribution": "Weights trained by Traverse on \"Optical Recognition of Handwritten Digits\" by E. Alpaydin and C. Kaynak, UCI Machine Learning Repository, https://doi.org/10.24432/C50P49 (CC BY 4.0)",
    "redistribution": "Redistribution permitted under CC BY 4.0 with the attribution above; signed with the test-only key (no production trust)",
    "commercial_use": "allowed",
    "source_url": "https://archive.ics.uci.edu/dataset/80/optical+recognition+of+handwritten+digits"
  },
  "supported_profiles": [
    "wasm-cpu"
  ],
  "max_memory_bytes": 131072,
  "max_fuel": 200000,
  "max_input_bytes": 268,
  "max_output_bytes": 64,
  "max_execution_ms": 1000,
  "offline_allowed": true
}
